{
  "$schema": "https://json-schema.org/draft/2020-12/schema",
  "$id": "https://github.com/fueledbycoffee/AgentScope/mapping-dsl-v1.schema.json",
  "title": "AgentScope mapping DSL v1",
  "description": "Declarative mapping from a source record to AgentScope's target schema (session, model_call, tool_call). The engine applies it; no code from the mapping runs. Structural rules only: the domain parser adds semantic checks (target fields, units, references, required fields).",
  "type": "object",
  "required": ["dsl_version", "target_schema_version", "name", "source", "input_format", "rules"],
  "properties": {
    "dsl_version": {"const": 1},
    "target_schema_version": {"const": 1},
    "name": {"type": "string", "minLength": 1},
    "source": {"type": "string", "minLength": 1},
    "input_format": {"enum": ["jsonl", "parquet"]},
    "rules": {"type": "array", "minItems": 1, "items": {"$ref": "#/$defs/rule"}},
    "unmapped": {"type": "array", "items": {"$ref": "#/$defs/unmapped"}},
    "notes": {"type": "string"}
  },
  "$defs": {
    "path": {
      "type": "string",
      "pattern": "^(\\$|@root)(\\.[A-Za-z_][A-Za-z0-9_-]*|\\[-?[0-9]+\\]|\\[\\*\\])*$",
      "description": "Restricted path: '$' is the current item, '@root' the root record; '.name', '[n]' and '[*]' only."
    },
    "fieldPath": {
      "type": "string",
      "pattern": "^(\\$|@root)(\\.[A-Za-z_][A-Za-z0-9_-]*|\\[-?[0-9]+\\])*$",
      "description": "Like path but without '[*]'."
    },
    "rule": {
      "type": "object",
      "required": ["id", "entity", "fields"],
      "properties": {
        "id": {"type": "string", "minLength": 1},
        "entity": {"enum": ["session", "model_call", "tool_call"]},
        "select": {"$ref": "#/$defs/path", "default": "$"},
        "where": {"type": "array", "items": {"$ref": "#/$defs/condition"}},
        "parent": {"type": ["string", "null"]},
        "native_key": {"type": "array", "items": {"type": "string"}},
        "fields": {
          "type": "object",
          "minProperties": 1,
          "additionalProperties": {"$ref": "#/$defs/field"}
        }
      }
    },
    "condition": {
      "type": "object",
      "required": ["path", "op"],
      "properties": {
        "path": {"$ref": "#/$defs/fieldPath"},
        "op": {"enum": ["eq", "ne", "in", "not_in", "exists", "not_exists"]},
        "value": {}
      }
    },
    "transform": {
      "oneOf": [
        {"enum": ["trim", "lower", "upper", "json_decode"]},
        {
          "type": "object",
          "minProperties": 1,
          "maxProperties": 1,
          "properties": {
            "trim": {"type": "object"},
            "lower": {"type": "object"},
            "upper": {"type": "object"},
            "json_decode": {"type": "object"},
            "enum_map": {
              "type": "object",
              "required": ["mapping"],
              "properties": {
                "mapping": {"type": "object"},
                "unmapped": {"enum": ["keep", "null", "reject"]}
              }
            }
          },
          "additionalProperties": false
        }
      ]
    },
    "field": {
      "type": "object",
      "properties": {
        "path": {"$ref": "#/$defs/fieldPath"},
        "paths": {"type": "array", "minItems": 1, "items": {"$ref": "#/$defs/fieldPath"}},
        "literal": {},
        "transforms": {"type": "array", "items": {"$ref": "#/$defs/transform"}},
        "type": {"enum": ["string", "integer", "number", "boolean", "timestamp"]},
        "timestamp_format": {"enum": ["iso8601", "epoch_s", "epoch_ms"]},
        "unit": {
          "type": "object",
          "required": ["from", "to"],
          "properties": {
            "from": {"enum": ["ns", "us", "ms", "s", "min"]},
            "to": {"enum": ["ns", "us", "ms", "s", "min"]}
          }
        },
        "empty_as_missing": {"type": "boolean"},
        "on_missing": {"enum": ["null", "default", "reject"]},
        "default": {},
        "on_invalid": {"enum": ["null", "reject"]}
      },
      "oneOf": [
        {"required": ["path"]},
        {"required": ["paths"]},
        {"required": ["literal"]}
      ]
    },
    "unmapped": {
      "type": "object",
      "required": ["path", "reason"],
      "properties": {
        "path": {"type": "string", "minLength": 1},
        "reason": {"type": "string", "minLength": 1}
      }
    }
  }
}
