{
  "dsl_version": 1,
  "target_schema_version": 1,
  "name": "tracelab-v1",
  "source": "tracelab",
  "input_format": "jsonl",
  "notes": "TraceLab v0.0.1 public release (syfi_coding_trace.jsonl.gz). One JSONL row is one recorded model invocation with nested tools[]. Sessions are reconciled by session_id; their observed bounds come from the model calls and tool calls, not from this mapping. Native ids are claimed identities only: round_id and trace_key are documented as non-unique upstream.",
  "rules": [
    {
      "id": "session",
      "entity": "session",
      "select": "$",
      "native_key": ["external_id"],
      "fields": {
        "external_id": {"path": "$.session_id", "on_missing": "reject"},
        "agent": {
          "path": "$.provider",
          "transforms": [
            {"enum_map": {"mapping": {"claude": "claude-code", "codex": "codex"}, "unmapped": "reject"}}
          ]
        },
        "user": {"path": "$.user"},
        "repo": {"path": "$.project"}
      }
    },
    {
      "id": "model_call",
      "entity": "model_call",
      "select": "$",
      "native_key": ["external_id"],
      "fields": {
        "session_external_id": {"path": "$.session_id", "on_missing": "reject"},
        "external_id": {"path": "$.trace_key"},
        "sequence": {"path": "$.round_index"},
        "provider": {"path": "$.provider"},
        "model": {"path": "$.model"},
        "started_at": {"path": "$.timing_events[*].timestamp", "timestamp_format": "iso8601", "bounds": "min"},
        "ended_at": {"path": "$.timing_events[*].timestamp", "timestamp_format": "iso8601", "bounds": "max"},
        "token_semantics": {
          "path": "$.provider",
          "transforms": [
            {"enum_map": {"mapping": {"claude": "tracelab-claude", "codex": "tracelab-codex"}, "unmapped": "reject"}}
          ]
        },
        "input_tokens": {"path": "$.input_tokens_total"},
        "output_tokens": {"path": "$.output_tokens"},
        "cache_read_tokens": {"path": "$.claude_cache_read_input_tokens"},
        "cache_creation_tokens": {"path": "$.claude_cache_creation_input_tokens"},
        "reasoning_tokens": {"path": "$.reasoning_output_tokens"}
      }
    },
    {
      "id": "tool_call",
      "entity": "tool_call",
      "select": "$.tools[*]",
      "parent": "model_call",
      "native_key": ["external_id"],
      "fields": {
        "external_id": {"path": "$.tool_call_id"},
        "sequence": {"path": "$.tool_index"},
        "tool_name": {"path": "$.tool_name", "on_missing": "reject"},
        "started_at": {"path": "$.emitted_at", "timestamp_format": "iso8601"},
        "ended_at": {"path": "$.result_at", "timestamp_format": "iso8601"},
        "wall_latency_ms": {"path": "$.tool_wall_latency_ms", "unit": {"from": "ms", "to": "ms"}},
        "internal_latency_ms": {"path": "$.tool_internal_latency_ms", "unit": {"from": "ms", "to": "ms"}},
        "is_error": {"path": "$.is_error"},
        "exit_code": {"path": "$.command_exit_code"},
        "status": {"path": "$.command_status"}
      }
    }
  ],
  "unmapped": [
    {"path": "$.round_id", "reason": "Documented as non-unique upstream (about 8,900 duplicates); trace_key is used as the claimed identity instead, and is itself not guaranteed unique."},
    {"path": "$.prefix_tokens", "reason": "TraceLab-specific split of input_tokens_total; no canonical field. Kept in the raw payload."},
    {"path": "$.newly_append_tokens", "reason": "TraceLab-specific split of input_tokens_total; no canonical field. Kept in the raw payload."},
    {"path": "$.claude_uncached_input_tokens", "reason": "Claude-only accounting detail; cache_read and cache_creation are mapped, the uncached remainder is derivable."},
    {"path": "$.timing_events", "reason": "Only the earliest and latest timestamps are used for the call bounds (the array is not chronological); the event stream itself is not modelled in v0.1.0."},
    {"path": "$.current_input_event_count", "reason": "Context-window composition counter; not part of the target schema."},
    {"path": "$.current_user_message_count", "reason": "Context-window composition counter; not part of the target schema."},
    {"path": "$.current_tool_result_count", "reason": "Context-window composition counter; not part of the target schema."},
    {"path": "$.current_user_message_chars", "reason": "Context-window composition counter; not part of the target schema."},
    {"path": "$.current_tool_result_chars", "reason": "Context-window composition counter; not part of the target schema."},
    {"path": "$.current_input_chars", "reason": "Context-window composition counter; not part of the target schema."},
    {"path": "$.first_input_event_type", "reason": "Not part of the target schema."},
    {"path": "$.store", "reason": "Source store label (e.g. .claude); provenance is recorded per file instead."},
    {"path": "$.turn_id", "reason": "Codex-only turn identifier present on Codex rows; order and claimed identity already come from round_index and trace_key. Kept in the raw payload."},
    {"path": "$.tools[*].input_chars", "reason": "Size of the removed tool input; not modelled."},
    {"path": "$.tools[*].result_chars", "reason": "Size of the tool result; not modelled."},
    {"path": "$.tools[*].continuation_of_tool_call_id", "reason": "Codex continuation links are not modelled in v0.1.0."}
  ]
}
